{
  "context_version": "0.1.0",
  "case_id": "CASE-C5A-FRONTIER",
  "hierarchy_questions": [],
  "principle_requests": [],
  "source_use_requests": [
    {
      "request_id": "softlaw:solvit-binding",
      "source_ref": "eu:32013h0461",
      "proposed_use": "binding_rule",
      "scope": "Synthetic attempt to recode a Commission recommendation as binding law."
    },
    {
      "request_id": "guidance:free-movement-interpretive",
      "source_ref": "eu:c-2023-1392",
      "proposed_use": "interpretive_support",
      "scope": "Synthetic interpretive use of Commission free-movement guidance."
    }
  ]
}
